"question","answer"
"Where are my examinations held?","Examination venues are published on your personal examination timetable in studentConnect. On campus venues are listed online along with links to the University map. 
 
If the venue on your timetable is Online LMS or Online LMS MS Team, please see the information on our web page. If your venue says Examination Organised by School, please see the information on your LMS."
"Does the UWA Student Guild charge a membership fee?","Guild membership is FREE!
You can choose to be a member of the UWA Student Guild by selecting 'Yes' to Guild membership, when you complete your online enrolment on studentConnect.
If you decide not to be a member of the Guild, you may revoke your Guild membership anytime, by selecting the option under 'Guild membership' in the Personal Details menu on studentConnect. Your name will then be removed from the Guild membership list."
"Does UWA Sport charge a membership fee?","Check the UWA Sports website for full details about membership."
"I have an Administrative Encumbrance. What should I do?","You can view your encumbrances and further information on studentConnect.
Financial encumbrances: You must pay your outstanding debt in order to have the encumbrance removed from your student record. Outstanding debts include unpaid fees such as your Student Services and Amenities Fee (SSAF), tuition fees, academic transcript fees, library fines, field trips or other unpaid fees and charges. To make payment for tuition and SSAF fees, log into studentConnect and make a payment under the Finance section. To make payments for other financial encumbrances visit the Online Payment Portal.
Other encumbrances: If your encumbrance doesn't relate to an outstanding fee, and you haven't received an email with information of how to clear it, or if you're unsure how to get the encumbrance cleared please Email Us."
"What happens if I have an Administrative Encumbrance?","If you have any outstanding debt(s) with the University or any administrative encumbrances on your record, you will be unable to:

Order any official documents from Student Administration,
View your results on studentConnect,
Re-enrol on studentConnect, and
Apply to, confirm or attend graduation.

Outstanding debts may include unpaid fees for tuition, student services and amenities (SSAF), late payment or enrolment, academic documents, campus card, library fines, field trips, or other unpaid fees and charges.
See: Paying Outstanding Debts to the University"
"How do I pay my outstanding debts to the University?","Your payment method options are determined by the type of debt:
 
Outstanding tuition fees or Student Services & Amenities Fees (SSAF)
You must pay these fees via the normal payment methods listed on your Statement of Account on studentConnect.
 
Your personal payment details and options can be viewed on studentConnect:

Log on to studentConnect
Select 'Statement of account' under the 'Finance' option
Select the relevant 'Fee Calendar' from the drop down menu
Click 'Show'
Select 'Pay Now' - Visa or MasterCard or Western Union

Other payment methods are also available.
 
Please allow 3-5 working days for clearance of your payment and removal of your encumbrance.
 
Late addition of a unit, Late cross-institutional application fee, Late transfer application fee and Campus Card replacement
Pay online through the payment portal with Visa or MasterCard.
 
If you have difficulty paying online and for all other debts
Payments can be made at Student Central by cheque, credit card (Visa or MasterCard) or EFTPOS."
"When will I receive my electronic Statement of Account (eSOA) for my Student Services and Amenities Fee (SSAF)?","Your electronic Statement of Account (eSOA) for the Student Services and Amenities Fees (SSAF) is issued in two or three instalments:

Semester-based enrolments will be issued a SSAF eSOA in February and July
Trimester-based enrolments will be issued a SSAF eSOA in January, April and July

Your eSOA (SSAF) is only available on studentConnect.

You will need to retrieve your eSOA by logging in to studentConnect with your student ID and Pheme password
Under the FINANCE section in the left hand menu, click on 'Statement of Account (eSOA)'
You will be able to select the eSOA for the Student Services and Amenities Fees (SSAF) from a drop down Fee Calendar menu
Click 'Pay Now'
Select your 'Payment method' - Visa or MasterCard or Western Union


Other payment methods are available.

Please allow 3 - 5 working days for your payment to be processed and to reflect on your studentConnect under 'Received Payments'."
"I was awarded academic credit/advanced standing, but I no longer need it. What can I do?","Contact your Student Advising Office via Email Us to check your academic credit/advanced standing. If you do not need the credit in order to complete your course, your Student Advising Office may be able to remove it for you."
"Who is my Student Adviser?","Your Student Adviser is a member of the Student Experience team dedicated to providing course and enrolment advice. Your allocated Student Advising Office is displayed on studentConnect when you login.
The Student Advising Offices are located across campus with varying opening times."
"How do I know if I have completed all the requirements for my course?","Login to studentConnect to check your completion status. If you have completed the requirements for your course, the completion date will be recorded.
If you believe you have completed your course and your completion date is not recorded contact your Student Advising Office.
Specific information relating to Progress Status is available online."
"What is Academic Progression?","Academic Progression is an assessment of your academic performance. At the end of each semester or trimester, your academic performance is assessed to determine your eligibility to continue studying your course. Academic Progression details can be viewed on studentConnect.

If you have made satisfactory progress you will be assigned the status of ""Good Standing"". You will then be permitted to re-enrol.
If you have failed to make satisfactory progress you may be placed on probation, suspended or excluded.

NOTE: This does not apply to Higher Degree by Research students. If you are a HDR student please contact the Graduate Research School for clarification on your course status."
"My Progress Status is Good Standing. What does this mean?","Congratulations, your academic performance has been assessed and determined you are eligible to re-enrol. You may continue studying your course and re-enrol."
"My Progress Status is Suspended. What does this mean?","If your progress status shows as ‘Suspended’ in studentConnect, it means you have not made satisfactory progress in your course, and your enrolment has been suspended.
You will not be able to re-enrol in your course in the next semester or trimester. You will receive an email from the University explaining your progress status, and the things you should do next.
Things to do next

Make an appointment with your Student Advising Office, they will help you figure out a plan for when you recommence your course.
Access the support services available at Student Support, such as counselling and STUDYSmarter.
If there were circumstances, such as illness, that affected your academic performance or if you believe your progress status does not fairly reflect the worth of the academic work you submitted, you can lodge a request for review within 20 days of receiving your progress status notification.
If you are an international student, you must contact the International Student Adviser to find out how your progress status affects your Student Visa.

NOTE: This does not apply to Higher Degree by Research students. If you are a HDR student please contact the Graduate Research School for clarification on your course status."
"My Progress Status is Excluded. What does this mean?","If your progress status shows as ‘Excluded' in studentConnect, it means you have not made satisfactory progress in your course and you are unable to re-enrol in your course. You will receive an email from the University explaining your progress status, and the things you should do next.
It's important you familiarise yourself with the University Policy on Academic Progress.
Things to do next

If there were circumstances, such as illness, that affected your academic performance or if you believe your progress status does not fairly reflect the worth of the academic work you submitted, you can lodge a request for review within 20 days of receiving your progress status notification.
If you are an international student, you must contact the International Student Adviser to find out how your progress status affects your Student Visa.
If you believe your circumstances have changed after 12 months of exclusion, you may apply for readmission to your course."
"I received a grade of FN (Fail due to non completion). What can I do?","You were awarded the grade FN because you withdrew after the last date you could withdraw without incurring an academic penalty.
If you believe there are extenuating circumstances explaining your late withdrawal, make an appointment with your Student Advising Office to discuss your circumstances."
"Can I appeal the result of my Honours thesis?","You can appeal the outcome of your Honours thesis if you are dissatisfied with the result awarded to you. Lodge an appeal in accordance with the appeal process."
"What should I do if I think the grade for one of my units is wrong?","If you think the grade for one of your units is wrong, contact your unit coordinator to have your result checked. If you are still not satisfied then you may submit a Review.
It is recommended you informally discuss your concerns with the relevant unit coordinator prior to lodging a formal request for a Review. Formal requests for review must be lodged within 10 working days of receipt of the academic decision. You will also need to determine whether you have grounds for a review in accordance with the University Policy on Review & Appeal of Academic Decisions Relating to Students."
"How do I apply for an extension of the due-date for my assignment?","Extensions are normally only granted if there are exceptional circumstances affecting your study, which you can substantiate with supporting documentation. To apply for an extension you need to:

Submit an application for Special Consideration no later than three University working days after the assessment is due or class missed); and
Attach supporting documents or evidence. For example, a medical certificate. 

Your application and supporting documentation will be treated confidentially.
Full details on Special Consideration, including eligibility criteria is published online on our Current Students' website."
"Can I find out my marks for each of my assignments?","Unit Coordinators are expected to be able to explain the mark awarded to you. Your work will be discussed in terms of the learning outcomes and marking criteria set for the unit.
Your Unit Coordinator can also, on request, arrange for you to view your marked examination scripts.
Some large units have a formal review session. You are expected to use these where available."
"Do I have to attend all my classes?","You are expected to attend all compulsory classes for your units, including labs, tutorials, seminars, workshops, etc. For some units, your assessment may include class participation and you may be required to attend/participate in a minimum number of classes. This may involve in-person or online attendance, depending on the mode of teaching in the unit. Check the unit outline and information on the Learning Management System (LMS) for details on attendance requirements for your unit/s.
If you are unable to attend a compulsory class, you should contact your Unit Coordinator as soon as possible. In some circumstances, you can apply to your Student Advising Office for Special Consideration, if you are eligible."
"What marks will I get for my supplementary examination?","If you pass your supplementary exam you will receive a grade of PS (Pass Supplementary). No mark will show on your record, however a mark of 50% will be used to calculate your WAM (Weighted Average Mark) and GPA (Grade Point Average).
If you fail your supplementary exam you will receive a grade of FS (Fail Supplementary). The original mark will show on your record and be used to calculate your WAM (Weighted Average Mark) and GPA (Grade Point Average) you received."
"When and where are my deferred/supplementary exams held?","Your personal exam timetable details are released at least 10 days before the commencement of each examination period on studentConnect.
Details on when the deferred/supplementary exams are held are available online. It is your responsibility to check these dates.
All supplementary and deferred examinations are held on campus at The University of Western Australia or online. Your exam timetable will include details about the location of each examination."
"What is special consideration?","Special consideration allows schools to take into account significant factors that may have affected your academic preparation or performance. If you think something serious is affecting your study contact your Student Advising Office as soon as possible.
Applications for special consideration must be submitted no later than three University working days after the date on which the relevant work for assessment was due. Evidence to support extenuating circumstances will be required as part of the application process if you submit after three University working days."
"What if I am ill during or before my exam period?","If you are ill during the exam period it is important you tell us by contacting your Student Advising Office as soon as possible. You may also apply for special consideration."
"What happens if I arrive late for my exam?","If you're up to 60 minutes late for your exam, you can still sit the exam, but you will not be granted extra time.
ON CAMPUS
What you should do when you arrive on campus depends on how late you are running for your exam.
•    If you are up to 60 minutes late, go directly to your examination venue. You will be permitted to sit the examination but no extra time will be allocated.
•    If you are more than 60 minutes late you will not be allowed to sit the exam. Report to your Student Advising Office as soon as possible if you require guidance on what to do next.
ONLINE
Students sitting MS Teams exams are required to log on up to 45 minutes before the start of the exam for an ID check and to resolve any technical issues. 
If you are more than 60 minutes late for your exam or have misread the timetable and missed your exam, you will not be allowed to sit the exam.
Student Administration is always open during exams for any questions or concerns you have about your exam. You can also contact us by phone on +618 6488 1212. If you're late as a result of circumstances beyond your control, you may be eligible to apply for special consideration to sit a deferred exam."
"I have a health condition. How can I implement exam adjustments?","Contact UniAccess, UWA's Disability and Accessibility Support Service, at least four weeks prior to the commencement of the exam period and they will make suitable arrangements for you. UniAccess is part of Student Support Services and is located on the 1st Floor of Student Central.
UniAccess can be contacted by email UniAccess or by phoning the call-back service on 6488 4630. UniAccess has an online booking system, offering face to face and virtual appointments: go to Book a UniAccess appointment."
"What happens if I experience difficulties during the year which may affect my exams?","If you are experiencing personal difficulties, speak with your Student Advising Office to request Special Consideration.
You can also contact the UWA Counselling and Psychological service. They provide a professional and confidential service which is free of charge to UWA students."
"What can and can't be brought into an exam?","All Examinations
 
You must take your UWA Student Campus Card or a valid government ID such as a driver's license or passport to all examinations and place it on your desk, including for online exams, and:


Your mobile phone must be switched off prior to entering an examination venue. It should be placed face up underneath your chair at all times.
Personal belongings including your bag may be taken into all venues. It must be stored underneath your chair. 

For on campus exams, do not leave your bag/valuables etc. outside examination venues. These items are your responsibility and the University does not take responsibility for any losses.
 

 
Check the permitted item on your exam timetable. This will be available 2 weeks before your exams, and outlines all approved materials for your exam, including whether use of an approved calculator is permitted.
 
You CAN take into Examinations:

Permitted item on your exam timetable.
Transparent pencil cases or bag - should only contain writing implements required to complete an exam.
Mobile phones may be taken into the exam venue but must be switched off prior to entrance and left in your bag or face up underneath your desk.
Bottled water only -  in a transparent bottle. Labels to be removed prior to entering the exam venue.

At the beginning of each examination you will be warned about unauthorised materials and given the opportunity to surrender materials in your possession without penalty.
 
You CANNOT take into Examinations:

Non-transparent pencil cases
Calculator cases
Caps, hats, wallets, headphones, ear buds/ plugs
Diaries
Personal organisers
Laptop computers (unless you are sitting an online exam)
Audio equipment, eg: microphone (unless you are sitting an online exam)
Smart watches or digital watches
iPods or MP3/4 players 
Any electronic item with an INTERNET CONNECTION, ELECTRONIC COMMUNICATION/ STORAGE DEVICE OR DIGITAL FACILITY (with the exception of a computer if you're sitting an online exam)


You CANNOT take into Examinations unless stated on the permitted items:

Calculators - approved models only with 'UWA approved stickers'. For online examinations, you must have a calculator from the approved list, however it does NOT need an approved sticker. 
Loose papers, including blank scrap paper for notes (for online exams)"
"What are the rules for my exams?","The University website has full details of the exam rules, please familiarise yourself with them before the exam period starts."
"What time will my exams start?","Examination start times are:

9:00am
2:00pm

Once published, your exam timetable is available via studentConnect."
"When is my exam timetable available?","Your personal exam timetable is published five weeks before the exam period on studentConnect.
The supplementary and deferred examination timetable is released at least 10 days before the exam period on studentConnect.
No alternative arrangements for examinations will be made for students who have made travel arrangements before their personal timetable has been released on studentConnect.
UWA staff members are not permitted to provide exam timetable information over the phone."
"What if my exams clash?","Follow these instructions if you have a clash in your exam timetable:

Your timetable will state the exam is in a clash venue, this means the clash has been resolved by the exams office, and your timetable is correct. Go to the venue published in your timetable twenty minutes prior to the start of your exam.

You will be required to sign a student declaration form before you can sit your exam, declaring that you have not sighted the examination paper, nor have you been in contact with anyone who has already sat the exam."
"Who can I talk to about my results?","If you would like to discuss your results, you should speak with your unit co-ordinator in regards to your individual units. If you are still dissatisfied you may consider submitting a Review.
It is recommended you informally discuss your concerns with the relevant unit coordinator prior to lodging a formal request for a Review. Formal requests for review must be lodged within 10 working days of receipt of the academic decision. You must also determine whether you have grounds for a review in accordance with the University Policy on Review & Appeal of Academic Decisions Relating to Students.

If you want to discuss your overall unit results and how your course plan may be impacted, contact your Student Advising Office."
"Will I receive advice of my results in the mail?","A hard copy advice of results is not mailed out. Your results will only be available on studentConnect once they have been released."
"When will my semester 2 results be released?","Examination periods and the dates when results are released are listed on the Exams website under important dates."
"My assessment is weighted. What does this mean?","Weighting means some of your assessments are worth more than others. This means assessments that were awarded the same raw mark will contribute differently to your overall mark for the unit.
For example: Imagine you have a mid-semester test that is marked out of 30 and you have a major assignment that is also marked out of 30. You see in your Unit Outline that the assignment is weighted at 50% of the final mark and the mid-semester test is weighted at 10% of the final mark. Ultimately, this means that if you score 20 out of 30 for both pieces of assessment, the mid-semester test contributes 6.6 marks (20/30 of 10 marks) and the major assignment contributes 33.3 marks (20/30 of 50 marks) to your final result."
"Can I still sit my exam if I have lost my Campus Card?","You won't be able to sit your exam unless you have your UWA student Campus Card, or Government issues ID such as a driver's license or passport with you.
If you have lost your student card report it online as soon as possible. To get a replacement, go to Student Administration near the Oak Lawn and Guild Village during opening hours.
Student Administration is also open for extended hours during exams for you to get a new or replacement campus card before your examination.
There is a replacement fee of $15 for students."
